{
  "schemaVersion": 1,
  "parameters": "/config/parameters.json",
  "tags": "/config/tags.json",
  "materials": [
    "/config/materials/red_whisker_ginseng.json",
    "/config/materials/azure_dew_leaf.json",
    "/config/materials/violet_star_flower.json",
    "/config/materials/golden_bell_fruit.json",
    "/config/materials/ash_spore_mushroom.json",
    "/config/materials/coiling_cloud_vine.json",
    "/config/materials/frost_marrow_crystal.json",
    "/config/materials/sinking_fragrance_bark.json"
  ]
}
